{
  "$schema": "https://json-schema.org/draft/2020-12/schema",
  "$id": "https://oas.dev/schemas/oas-package.schema.json",
  "title": "OAS distribution package manifest (staging)",
  "type": "object",
  "required": ["package", "version", "description", "compatibility", "capabilities"],
  "properties": {
    "package": {
      "type": "string",
      "pattern": "^(?:@?[a-z0-9][a-z0-9._-]*[./])[a-z0-9][a-z0-9._/-]*$"
    },
    "version": { "type": "string", "minLength": 1 },
    "description": { "type": "string", "minLength": 1 },
    "compatibility": {
      "type": "object",
      "required": ["oas"],
      "properties": {
        "oas": { "type": "string", "minLength": 1 }
      },
      "additionalProperties": false
    },
    "capabilities": {
      "type": "array",
      "minItems": 1,
      "uniqueItems": true,
      "items": { "type": "string", "minLength": 1 }
    },
    "configs": {
      "type": "object",
      "additionalProperties": {
        "type": "object",
        "required": ["path", "description"],
        "properties": {
          "path": { "type": "string", "minLength": 1 },
          "description": { "type": "string", "minLength": 1 },
          "default": { "type": "boolean" }
        },
        "additionalProperties": false
      }
    },
    "dependencies": {
      "type": "array",
      "uniqueItems": true,
      "items": { "type": "string", "minLength": 1 }
    }
  },
  "additionalProperties": false
}
